Title,Ingredients,Steps
알배추전,알배추잎 (4장); 부침가루 (1컵); 물 (1컵); 밀가루 (약간); 소금 (약간),한 면이 노릇하게 익었으면 뒤집어서 반대면도 익혀주세요. (https://recipe1.ezmember.co.kr/cache/recipe/2026/04/20/4929a854165ac85de6f111c501ba290e1.jpg); 접시에 담고 전간장을 곁들여 완성합니다. (https://recipe1.ezmember.co.kr/cache/recipe/2026/04/20/03d257b14156632983342901923e68aa1.jpg)
동글동글 귀여운 메추리알 장조림 만드는법 초간단 레시피,,"점점 색이 입혀집니다
이때 간 보고 입맛에 맞게 간장 추가해주세요 (https://recipe1.ezmember.co.kr/cache/recipe/2026/04/16/8c42cee6baea5fc27b3ef293c6f41f451.jpg); 거의 다 졸여지면 물엿을 넣어줍니다
단맛 코팅 ! (https://recipe1.ezmember.co.kr/cache/recipe/2026/04/16/2858ec219c2fc1481f837ee70b9f726d1.jpg)"
"바삭 달콤 밥도둑, 밥새우볶음으로 완성하는 초간단 후리카케 레시피",,설탕을 두큰술 넣어주시고 설탕이 고루 녹아 코팅되도록 계속 저어줍니다. (https://recipe1.ezmember.co.kr/cache/recipe/2026/04/16/2eabfc195aa85cb41dd7062e6cb471c91.jpg)
참치 김치찌개 만드는 법 떡국떡 이용한 황금 레시피,,마지막으로 대파를 넣고 2~3분만 더 끓여주면 완성입니다. 여기에 순두부를 넣어도 잘 어울려요. 버섯 등을 추가하면 부족한 영양을 더 할 수 있겠지요? (https://recipe1.ezmember.co.kr/cache/recipe/2026/04/06/012126b6477e7a42cc66ae67100d47141.jpg)
매콤떡볶이,,처음에는 강불로 볶아주다가 약불로 불조절을 해가면서 마무리해주세요. (https://recipe1.ezmember.co.kr/cache/recipe/2026/04/06/f73b54354e2d792ecc3283f1e778edc11.jpg); 매콤떡볶이가 완성이 되었습니다. (https://recipe1.ezmember.co.kr/cache/recipe/2026/04/06/1ed44312b3509a4c5b9c683310ec4aa71.jpg)
얼큰 무청시래기 소고기 된장국,,"소고기가 익을 때까지 끓인 후 대파를 넣고 한소끔 더 끓여주세요.
부족한 간은 참치액젓으로 맞추고 불을 꺼주세요. (https://recipe1.ezmember.co.kr/cache/recipe/2026/04/12/a92087b1b3213346dd8d9da8cc1e4ff41.jpg); 따뜻할 때 그릇에 담고 완성합니다. (https://recipe1.ezmember.co.kr/cache/recipe/2026/04/12/87933195acb75a337ff82ea2ef84e20a1.jpg)"
취나물 된장무침 (야생 취나물),,"반찬통에 담는다
반찬통 (https://recipe1.ezmember.co.kr/cache/recipe/2026/04/21/5a657bb82209ed3efcba090a33dd9b3e1.jpg); 접시에
먹을만큼만 덜어낸다
접시 (https://recipe1.ezmember.co.kr/cache/recipe/2026/04/21/5771ac21360c700b975931b391a152dd1.jpg)"
연두부 양념장 만들기 다이어트 연두부 요리 레시피,,소스볼에 양념 재료를 모두 넣은 뒤 다진 대파나 쪽파를 넣고 섞어 연두부 양념장을 만들어 주세요. (https://recipe1.ezmember.co.kr/cache/recipe/2026/04/13/ea7b6d58af1902af9d4bcfe40d8f49f91.jpg); 그릇에 연두부를 담고 먹기 전에 양념장을 올려 드세요. (https://recipe1.ezmember.co.kr/cache/recipe/2026/04/13/aaea7a9b00d4b974f9747d64c93f652b1.jpg)
다이어트두부면(17칼로리)불 없이만드는 시원한 두부면콩국수,,콩물이완성도면 얼음넣고 소금간약간하시고 두부면을 넣어주세요 (https://recipe1.ezmember.co.kr/cache/recipe/2026/04/16/8bb27bfc41e8277c8f4d1da3570e80a91.jpg); 준비해놓은 고명을 위에올려주시고 깨소금넣어주세요 (https://recipe1.ezmember.co.kr/cache/recipe/2026/04/16/1fcd9617d2a9f3c02d1d1d86fd5c55621.jpg)
굴소스 팽이버섯 계란 덮밥 만들기 한 그릇 레시피,,저는 반숙보다는 조금 익게 하여 5분 정도 익혀주었어요. 취향에 맞게 해주세요. (https://recipe1.ezmember.co.kr/cache/recipe/2025/11/07/a47dfb9989df4a30d225f6c4758a62701.jpg); 그릇에 밥 한 공기를 펼쳐주시고 팽이버섯 계란 볶음을 살포시 덮어주세요. 대파를 올려주시고 고소하라고 참기름 1T 넣어주세요. (https://recipe1.ezmember.co.kr/cache/recipe/2025/11/07/84a207eda0cf7d23c4ff352548af59eb1.jpg)
매운 돼지갈비찜 황금레시피 돼지갈비찜 양념장,,
매콤하게 구워 더 맛있는 새송이버섯 매콤구이 레시피 (1봉지로 만드는 초간단 반찬),,재료가 간단해서 좋은 레시피 입니다. (https://recipe1.ezmember.co.kr/cache/recipe/2026/03/19/bf67c431d2f6128f205577c72713bcca1.jpg); 마지막으로 통깨와 검은깨를 뿌려 마무리하면 완성입니다. 새송이버섯 매콤 구이 완성! (https://recipe1.ezmember.co.kr/cache/recipe/2026/03/19/7f667b09441ffa53050ddf2f9a462c031.jpg); 맛 표현 한입 먹으면 새송이버섯 특유의 쫄깃한 식감이 살아 있고 참기름의 고소함에 매콤달콤한 양념이 입맛을 확 살려 줍니다. 버섯이지만 마치 매콤한 버섯 스테이크 처럼 느껴지는 맛이라 밥 위에 올려 먹어도 정말 맛있는 반찬이에요. (https://recipe1.ezmember.co.kr/cache/recipe/2026/03/19/bb82dc79591e1f19e8044586073854831.jpg)
숙주나물 무침 만들기 아삭한 숙주나물 무침 양념 레시피 깔끔한 밑반찬 요리,,
김치청국장 맛있게 끓이기,,"양파, 대파, 다진마늘도 넣고
한 소끔 끓일게요 (https://recipe1.ezmember.co.kr/cache/recipe/2026/04/15/d362bfb7d9ce4918d5492202644464d21.jpg); 김치청국장찌개 완성~ (https://recipe1.ezmember.co.kr/cache/recipe/2026/04/15/880dc528acc7da4f9e800899622296451.jpg)"
간장 두부조림 레시피 두부조림 양념장 황금레시피,,
초간단 어묵국,,"대파를
넣고 1분정도 더
끓여줍니다. (https://recipe1.ezmember.co.kr/cache/recipe/2026/03/26/02d39c2099369cde70d5daa7dfcad1ce1.jpg); 기호에
따라 후추 톡톡
넣어 완성합니다. (https://recipe1.ezmember.co.kr/cache/recipe/2026/03/26/a0f4ce7bb5c3323d98efb4778530b63f1.jpg); 어묵국
완성! (https://recipe1.ezmember.co.kr/cache/recipe/2026/03/26/e83a359a43019ec48a34073e2428a9c11.jpg)"
시금치된장 고추장넣었더니?이맛뭐죠?밥두공기 순삭,,"양념넣은물이끓으면 시금치를넣어준다 (https://recipe1.ezmember.co.kr/cache/recipe/2026/04/03/bb351decfc660f935b26cb5764b964071.jpg); 시금치는 오래끓여야 더맛있다
살짝익힌거 좋아하시는분은 끓으면 불끄지만 저는푹익는거좋아해서
약불에뚜겅닫고20분은끓여준다 (https://recipe1.ezmember.co.kr/cache/recipe/2026/04/03/de98afc8b74633a2f9f324087b7e82441.jpg)"
오이고추된장무침 (사계절 먹기좋은 밑반찬 고추무침 5분 레시피),,잘 섞어 놓은 된장 양념에 오이고추를 모두 넣어준다 (https://recipe1.ezmember.co.kr/cache/recipe/2023/09/15/bfbe3233f2f49619072094c2081b97221.jpg); 수저로 저어가면서 고루 무쳐준다 (https://recipe1.ezmember.co.kr/cache/recipe/2023/09/15/c569686692749d8879a3570b76f48fa31.jpg)
다이어트 식단 애호박 당근라페 덮밥,,준비된 밥 위로 올리브 오일에 볶은 애호박 먼저 올려주세요 (https://recipe1.ezmember.co.kr/cache/recipe/2026/04/14/b283418ea6959f48559ea78e906f06941.jpg); 당근라페도 올려줍니다 (https://recipe1.ezmember.co.kr/cache/recipe/2026/04/14/b20387af78eaac6b025d82539695cbc31.jpg); 달걀프라이 하나 올려 맛있게 드세요 (https://recipe1.ezmember.co.kr/cache/recipe/2026/04/14/b07a36bcec436fcd7085b3cd9430ff861.jpg)
도시락 반찬으로 최고! 스팸감자조림♡,,
[두부계란덮밥] 두부를 이용한 건강한 다이어트 밥상,,"다 볶았으면 밥 위에 두부계란을 올려주시고
접시 (https://recipe1.ezmember.co.kr/cache/recipe/2025/06/02/86f57fbf8385ccf7410a7d9d7473e7a41.jpg); 들기름 조금에 깨까지 넣어주면 (https://recipe1.ezmember.co.kr/cache/recipe/2025/06/02/0ec40101a8122f8026f518c3009c6fa31.jpg); 진짜 맛있는 '두부계란덮밥'이 완성~! 감칠맛에 단백질도 가득들어가 있고 중독적인 맛이여서 자주 먹고 있어요~~! (https://recipe1.ezmember.co.kr/cache/recipe/2025/06/02/b57e864874473feddc7ac284cb48599b1.jpg)"
양배추 오믈렛/다이어트 식단,,"쭉~늘어나는 치즈로 먹는 재미도 있어요. (https://recipe1.ezmember.co.kr/cache/recipe/2024/09/28/a79bc8e3857f32fee53833580109a6671.jpg); 계란,치즈의 고소함과 아삭한 양배추가 듬뿍 들어 푸짐하고 든든해요. (https://recipe1.ezmember.co.kr/cache/recipe/2024/09/28/0ac4e55fbce22d91962f97e1b88dc8cc1.jpg)"
간장버터 새송이구이,,"이렇게 양념이 졸여지면 불을 꺼주세요 (https://recipe1.ezmember.co.kr/cache/recipe/2024/01/24/553510878a8b785cd5c6e705908705601.jpg); 이렇게 하면 맛있는 간장버터 새송이버섯 구이 완성입니다!
플레이팅접시 (https://recipe1.ezmember.co.kr/cache/recipe/2024/01/24/7be10fd6bdea73f77a5a639bdc7e68da1.jpg)"
단무지무침 레시피 밑반찬 만들기 치자 단무지무침,,"일회용 장갑을 끼고 단무지에 양념이 골고루 입혀지도록 조물조물 버무려주면 단무지무침 레시피 완성입니다. (https://recipe1.ezmember.co.kr/cache/recipe/2025/12/09/c9cf4128f585b77a9be0778297567ac51.jpg); 단무지는 기본적인 간이 되어 있기 때문에 간을 추가하지 않아도 되지만, 새콤한 단무지무침을 좋아하는 분은 식초를 살짝 추가하고 다시 버무려주면 되세요. (https://recipe1.ezmember.co.kr/cache/recipe/2025/12/09/57cd8bad79183911490fc3e3f2a982c91.jpg)"
시금치무침 (시금치데치는 방법 시금치나물요리 나물반찬 반찬레시피),,"무침 양념을 모두 넣어준다
믹싱볼 , 조리용스푼 (https://recipe1.ezmember.co.kr/cache/recipe/2024/03/22/8652d20735e27d7ba66542ea1c5854541.jpg); 조물조물 양념과 시금치가 고루 섞이 도록 무쳐준다 (https://recipe1.ezmember.co.kr/cache/recipe/2024/03/22/86f1c55a7874470396689277b0f7bbd11.jpg)"
매운빨간콩나물무침 레시피 매일반찬,,"으깬 통깨를 적당히 넣어준 후 조물조물 무쳐주시면 완성입니다.
위생장갑 (https://recipe1.ezmember.co.kr/cache/recipe/2024/05/05/259934859c86a1f7e708c92122ef9d321.jpg); 매콤 고소한 빨간콩나물무침 완성입니다. 콩나물 잘게 잘라 밥이랑 슥슥 비벼먹어도 맛있어요.
접시 (https://recipe1.ezmember.co.kr/cache/recipe/2024/05/05/aca87b223cf8b696e461cd2a6b31e06b1.jpg)"
새송이버섯버터굴소스볶음 간단반찬,,통깨도 넣어서 섞어 줍니다 (https://recipe1.ezmember.co.kr/cache/recipe/2022/12/09/d7d056ce324fce426dbfdf03798432791.jpg); 미니 새송이버섯 버터굴소스볶음 완성입니다. (https://recipe1.ezmember.co.kr/cache/recipe/2022/12/09/79f018cbf19bb69a95bec4d38a2c8c7a1.jpg)
아이반찬 양파소세지볶음 레시피 양파요리 초스피드반찬,,통깨 넉넉하게 뿌려서 잘섞어주면 완성입니다. (https://recipe1.ezmember.co.kr/cache/recipe/2022/10/15/09f7a153eaced6b65cb200c52cbad79e1.jpg); 접시에 담아서 맛있게드세요. (https://recipe1.ezmember.co.kr/cache/recipe/2022/10/15/e6c21f069966e3ff75a8e26cf58e0a2f1.jpg)
청포묵 무침 만드는 법,,"볼에 청포묵을 담고 김가루 두 줌, 소금 1/2t, 통깨 1T, 참기름 1T 넣어 살살 버무려주세요. 묵은 쉽게 부서지니 숟가락보다 손으로 부드럽게 섞는 게 좋아요. (https://recipe1.ezmember.co.kr/cache/recipe/2026/01/27/cc24f835ca9563fa6aa81bdc42b3bc811.jpg); 부드러운 청포묵무침 완성입니다. (https://recipe1.ezmember.co.kr/cache/recipe/2026/01/27/fd0832039e59285da505dafe046446041.jpg)"
"즉석,오이 부추 무침(백종원양념)",,"양념을 넣어주고 잘 버무려줍니다.
위생장갑
단맛이 싫으시면 올리고당을 반으로 줄여주세요. (https://recipe1.ezmember.co.kr/cache/recipe/2024/06/30/674dd2dd0045273f188a9412483e14eb1.jpg); 통깨 톡톡 부려주면 오이 무침 완성입니다. (https://recipe1.ezmember.co.kr/cache/recipe/2024/06/30/1c4bea6b5c76147f9e8dddca66c64c9a1.jpg)"
청경채 된장 무침으로,,마지막 통깨와 송송 썬 쪽파까지 넣고 무쳐서 완성해 주세요 (https://recipe1.ezmember.co.kr/cache/recipe/2023/06/03/228a63c27ad661d8c295272d85b60cf41.jpg); 역시 나물은 들기름에 무쳐야 맛있어요 된장과 들기름 그리고 아삭한 청경채가 조화로워요 (https://recipe1.ezmember.co.kr/cache/recipe/2023/06/03/30909b579375b1ea74f467178e73ebcd1.jpg)
여름반찬 아삭오이고추 만능된장무침 레시피,,"그리고 올리고당1t을 넣고 (https://recipe1.ezmember.co.kr/cache/recipe/2024/06/25/3f826145d005ce0fc5bc3a5ae8aac2211.jpg); 통깨약간.참기름1t을 넣어 주세요. (https://recipe1.ezmember.co.kr/cache/recipe/2024/06/25/a77c35611e4a3443e6752889814f745c1.jpg); 그리고 조물 조물 무쳐주면 맛있는 오이고추 된장 무침이 완성이 된답니다.
접시 (https://recipe1.ezmember.co.kr/cache/recipe/2024/06/25/3e9128a3e2f3af7acbe02b169bfb870e1.jpg)"
"여름 반찬, 매콤하고 시원한 오이 냉국 만들기",,
저렴하게 반찬 뚝딱!! 감자조림 만들기,,"양념이 감자에 충분히 스며들도록 적당히 섞어주세요. (https://recipe1.ezmember.co.kr/cache/recipe/2025/05/05/1f965b5c09abfc05fd796e008b6e4eb51.png); 국물이 꾸덕해주시면 통께 뿌리고 완성입니다.
통깨 (https://recipe1.ezmember.co.kr/cache/recipe/2025/05/05/8cb7eeb57acd72bac5b3a556af2d90931.png)"
#최애반찬#소세지강정,,양념장을 넣고 달달 볶아주세요. (https://recipe1.ezmember.co.kr/cache/recipe/2020/05/18/2b37f9e5d7990742faa631394b7271511.jpg); 윤기 및 달달한 맛을 추가하기 위해 올리고당 한바퀴만 둘러주면 밥도둑 최애반찬 완성입니다. (https://recipe1.ezmember.co.kr/cache/recipe/2020/05/18/090db4d15ba93270b26b8b0834a837781.jpg)
도토리묵김무침 레시피 아이반찬,,깨도 듬뿍 넣어주세요. (https://recipe1.ezmember.co.kr/cache/recipe/2023/07/10/6ccb98f5d6e6a53294e4d97172aff8581.jpg); 그리고 부셔둔 김가루를 넣어준 후 잘 비벼주시면 아이반찬 탱글탱글 고소한 도토리묵김무침이 완성됩니다. 맛있게 드세요. (https://recipe1.ezmember.co.kr/cache/recipe/2023/07/10/c775d9e3b7071aef9e39c2aa97a457ca1.jpg)
칼칼한 오징어무국 맛있게 끓이는 법,,
"고소한 맛이 좋은 밑반찬, 애호박버섯볶음 만들기(새우젓없이 만들기)",,"국물이 다 졸면 불을 꺼주세요. 그리고 참기름 0.5T와 후춧가루 조금, 마지막으로 깨소금 0.5T를 넣고 섞어주세요. (https://recipe1.ezmember.co.kr/cache/recipe/2022/10/31/8b373ca30471e2d90c6b86ac3d80b1771.jpg); 애호박버섯볶음 완성이에요. (https://recipe1.ezmember.co.kr/cache/recipe/2022/10/31/1269788513e6c9db8f72ca480c6afae41.jpg)"
베이컨감자채볶음,,후라이팬에 기름을 넉넉하게 두른후 감자가 투명해 질때까지 볶아주세요.어느정도 감자가 투명하게 볶아지면 대파와 양파를 송송 썰어서 넣어주세요. (https://recipe1.ezmember.co.kr/cache/recipe/2023/08/08/735d22babcc0e392ca35e5ccb1c915831.jpg); 감자채베이컨볶음이 완성이 되었습니다. (https://recipe1.ezmember.co.kr/cache/recipe/2023/08/08/c33c56ab2be9ccff63d4729b27fd2ba31.jpg)
단짠단짠 고기없이깊은맛! 메추리알장조림만드는법표고버섯장조림,,"메추리알이 색이스며들고 물이약간졸으면
표고버섯8등분한거 4개를 다넣고졸여 주세요 불은 중약불입니다 (https://recipe1.ezmember.co.kr/cache/recipe/2026/04/03/06a650cc6d19db3808df4dfd2d1cc1561.jpg); 국물이 어느정도 졸여지면. 설탕4숟가락 넣어주면서 깨소금 참기름넣고 섞어주면 맛있는 표고버섯 장조림완성입니디 (https://recipe1.ezmember.co.kr/cache/recipe/2026/04/03/d9a4eb91b56f5b0223f9bde871e1719c1.jpg)"
